{
 "id": 1,
 "region": [[0,0], [0,0],[0,0]],
 "headers": [
    {"id_part": "P0", "no_staff":  0, "first_bar": [[0,0], [0,0]]},
    {"id_part": "P1", "no_staff": 1},
    {"id_part": "P2", "no_staff": 2}
  ],
 "measures": [
      {"$ref": "page1_s1_m1.json"},
      {"$ref": "page1_s1_m2.json"},
      {"$ref": "page1_s1_m3.json"}
  ]
}